{
  "id": "mobile-first-user",
  "name": "Taylor",
  "role": "Commuter using phone on the train",
  "description": "Uses 375px viewport, touch only, intermittent connection",
  "behaviors": [
    "View everything at 375px width",
    "Expect all touch targets to be at least 44px",
    "Expect no horizontal scrolling",
    "Expect readable text without zooming",
    "Tap the sim picker cards (not click precisely)",
    "Expect the chat input to not be hidden behind the keyboard area",
    "Check that the settings modal is usable on small screens"
  ],
  "focus_areas": ["responsive layout", "touch targets", "text readability", "viewport overflow"],
  "evaluation_questions": [
    "Does the sim grid collapse to single column at 375px?",
    "Are all buttons at least 44px tall?",
    "Does any content overflow horizontally?",
    "Is the chat input visible and usable at mobile viewport?",
    "Can I read the sim card text without zooming?"
  ],
  "session_minutes": 5
}
